{
  "manifestVersion": "1.0.0",
  "hubId": "unit-3-cyber-security",
  "name": "Unit 3 Cyber Security Hub",
  "description": "Learner hub for OCR Level 3 IT Unit 3 Cyber Security.",
  "version": "0.2.0",
  "repositoryUrl": "https://github.com/Acerosa/unit-3-Cyber-Security-Hub",
  "deploymentUrl": "https://acerosa.github.io/unit-3-Cyber-Security-Hub",
  "courses": [
    "ocr-level-3-it"
  ],
  "compatibility": {
    "required": {
      "coreVersion": "0.2.5",
      "learnerApiContractVersion": "0.1.0",
      "submissionContractVersion": "0.1.0"
    },
    "testedCombinations": [
      {
        "coreVersion": "0.2.5",
        "learnerApiContractVersion": "0.1.0",
        "submissionContractVersion": "0.1.0"
      }
    ]
  },
  "capabilities": {
    "evidence": [
      "question-level"
    ],
    "activities": [
      "classification",
      "matching",
      "reflection",
      "retrieval-quiz"
    ]
  },
  "featureFlags": {
    "authentication": true,
    "onboarding": true,
    "progress": true
  }
}
